<?xml version="1.0" encoding="UTF-8"?>

<workflow
xmlns:xsi="http://www.w3.org/2001/XMLSchema-instance"
xsi:noNamespaceSchemaLocation="workflow.xsd">

<channel name="c1">
    <global>in</global>
	<init> C1 Value </init>
</channel>
<channel name="c2"/>
<channel name="c3">
    <global>out</global>
</channel>
<process name="p1">
    <input>c1</input>
    <output>c2</output>
    <command>#!/bin/sh&#xA;sleep 1&#xA;cat c1  | cut -c -6 &gt; c2</command>
</process>
<process name="p2">
    <input>c2</input>
    <output>c3</output>
    <command>#!/bin/sh&#xA;sleep 1&#xA;cat c2  | cut -c 2- &gt; c3</command>
</process>

</workflow>
