<?xml version="1.0" encoding="UTF-8"?>

<workflow
xmlns:xsi="http://www.w3.org/2001/XMLSchema-instance"
xsi:noNamespaceSchemaLocation="workflow.xsd">

<channel name="c1">
    <global>in</global>
	<init>some data</init>
</channel>
<channel name="c2"/>
<channel name="c3"/>
<channel name="c4">
    <global>out</global>
</channel>
<mux name="m1">
    <input>c2</input>
    <input>c3</input>
    <output>c4</output>
</mux>
<process name="p1">
    <input>c1</input>
    <output>c2</output>
    <output>c3</output>
    <script>scripts/6.1.sh</script>
</process>

</workflow>